{
  "id": "019a2b3c-4d5e-7f00-8a00-000000000035",
  "device_id": "019a2b3c-4d5e-7f00-8a00-000000000004",
  "seq": 414,
  "type": "incident",
  "payload": {
    "incident_id": "019a2b3c-4d5e-7f00-8a00-000000000023",
    "shift_id": "019a2b3c-4d5e-7f00-8a00-000000000020",
    "category": "open_door",
    "note": "A raktár hátsó ajtaja nyitva volt.",
    "lat_e7": 474979100,
    "lng_e7": 190402300,
    "accuracy_dm": 80,
    "nearest_checkpoint_id": "019a2b3c-4d5e-7f00-8a00-000000000005",
    "scan_id": null,
    "media": [
      {
        "id": "019a2b3c-4d5e-7f00-8a00-000000000024",
        "sha256": "677e912d1a8aa1101fe271bab42c91be187bd6076ff1281335db85e3477f6ce1"
      },
      {
        "id": "019a2b3c-4d5e-7f00-8a00-000000000025",
        "sha256": "b1946ac92492d2347c6235b4d2611184b1946ac92492d2347c6235b4d2611184"
      }
    ]
  },
  "device_time": "2026-10-27T21:03:44.120Z",
  "uptime_ms": 86400123,
  "boot_id": "android-17",
  "gnss_time": null,
  "ref_server_time": "2026-10-27T19:58:02.511Z",
  "ref_uptime_ms": 82500000,
  "ref_boot_id": "android-17",
  "prev_hash": "aaaaaaaaaaaaaaaaaaaaaaaaaaaaaaaaaaaaaaaaaaaaaaaaaaaaaaaaaaaaaaaa",
  "hash": "bbbbbbbbbbbbbbbbbbbbbbbbbbbbbbbbbbbbbbbbbbbbbbbbbbbbbbbbbbbbbbbb"
}
