{
  "id": "019a2b3c-4d5e-7f00-8a00-000000000030",
  "device_id": "019a2b3c-4d5e-7f00-8a00-000000000004",
  "seq": 9007199254740991,
  "type": "round_closed",
  "payload": {
    "round_id": "019a2b3c-4d5e-7f00-8a00-000000000021",
    "status": "completed",
    "finished_at": "2026-10-27T20:14:05.120Z"
  },
  "device_time": "2026-10-27T21:03:44.120Z",
  "uptime_ms": 9007199254740991,
  "boot_id": "android-17",
  "gnss_time": null,
  "ref_server_time": "2026-10-27T19:58:02.511Z",
  "ref_uptime_ms": 82500000,
  "ref_boot_id": "android-17",
  "prev_hash": "aaaaaaaaaaaaaaaaaaaaaaaaaaaaaaaaaaaaaaaaaaaaaaaaaaaaaaaaaaaaaaaa",
  "hash": "bbbbbbbbbbbbbbbbbbbbbbbbbbbbbbbbbbbbbbbbbbbbbbbbbbbbbbbbbbbbbbbb"
}
