{
  "id": "019a2b3c-4d5e-7f00-8a00-000000000033",
  "device_id": "019a2b3c-4d5e-7f00-8a00-000000000004",
  "seq": 3,
  "type": "round_opened",
  "payload": {
    "round_id": "019a2b3c-4d5e-7f00-8a00-000000000021",
    "shift_id": "019a2b3c-4d5e-7f00-8a00-000000000020",
    "route_version_id": "019a2b3c-4d5e-7f00-8a00-000000000008",
    "schedule_id": "019a2b3c-4d5e-7f00-8a00-000000000009",
    "scheduled_at": "2026-10-27T20:00:00.000Z",
    "time_limit_min": 20
  },
  "device_time": "2026-10-27T21:03:44.120Z",
  "uptime_ms": 86400123,
  "boot_id": "android-17",
  "gnss_time": null,
  "ref_server_time": "2026-10-27T19:58:02.511Z",
  "ref_uptime_ms": 82500000,
  "ref_boot_id": "android-17",
  "prev_hash": "aaaaaaaaaaaaaaaaaaaaaaaaaaaaaaaaaaaaaaaaaaaaaaaaaaaaaaaaaaaaaaaa",
  "hash": "bbbbbbbbbbbbbbbbbbbbbbbbbbbbbbbbbbbbbbbbbbbbbbbbbbbbbbbbbbbbbbbb"
}
