{
  "id": "019a2b3c-4d5e-7f00-8a00-000000000032",
  "device_id": "019a2b3c-4d5e-7f00-8a00-000000000004",
  "seq": 2,
  "type": "shift_closed",
  "payload": {
    "shift_id": "019a2b3c-4d5e-7f00-8a00-000000000020",
    "closed_by": "handover"
  },
  "device_time": "2026-10-27T21:03:44.120Z",
  "uptime_ms": 86400123,
  "boot_id": "android-17",
  "gnss_time": null,
  "ref_server_time": "2026-10-27T19:58:02.511Z",
  "ref_uptime_ms": 82500000,
  "ref_boot_id": "android-17",
  "prev_hash": "aaaaaaaaaaaaaaaaaaaaaaaaaaaaaaaaaaaaaaaaaaaaaaaaaaaaaaaaaaaaaaaa",
  "hash": "bbbbbbbbbbbbbbbbbbbbbbbbbbbbbbbbbbbbbbbbbbbbbbbbbbbbbbbbbbbbbbbb"
}
