{
  "id": "019a2b3c-4d5e-7f00-8a00-000000000031",
  "device_id": "019a2b3c-4d5e-7f00-8a00-000000000004",
  "seq": 1,
  "type": "shift_started",
  "payload": {
    "shift_id": "019a2b3c-4d5e-7f00-8a00-000000000020",
    "guard_id": "019a2b3c-4d5e-7f00-8a00-000000000003",
    "site_id": "019a2b3c-4d5e-7f00-8a00-000000000001"
  },
  "device_time": "2026-10-27T21:03:44.120Z",
  "uptime_ms": 86400123,
  "boot_id": "android-17",
  "gnss_time": null,
  "ref_server_time": null,
  "ref_uptime_ms": null,
  "ref_boot_id": null,
  "prev_hash": "0000000000000000000000000000000000000000000000000000000000000000",
  "hash": "bbbbbbbbbbbbbbbbbbbbbbbbbbbbbbbbbbbbbbbbbbbbbbbbbbbbbbbbbbbbbbbb"
}
